{
  "specVersion": "0.2.0-draft",
  "id": "profile_vendor_acme_001",
  "type": "CapabilityProfile",
  "createdAt": "2026-05-11T09:00:00Z",
  "updatedAt": "2026-05-11T09:00:00Z",
  "supportedVersions": {
    "0.2.0-draft": "/.well-known/upp"
  },
  "vendor": {
    "id": "vendor_acme_industrial",
    "name": "Acme Industrial Supply",
    "contactEmail": "integrations@acme.example",
    "externalIds": {
      "erpVendorId": "ACME-2041"
    }
  },
  "supportedModules": [
    "UPP Core",
    "UPP Discovery",
    "UPP Capabilities",
    "UPP RFQ",
    "UPP Orders",
    "UPP Invoice",
    "UPP Identity",
    "UPP Extensions"
  ],
  "services": {
    "com.b2bprotocol.procurement": [
      {
        "version": "0.2.0-draft",
        "spec": "https://b2bprotocol.com/specification/overview",
        "transport": "rest",
        "schema": "https://b2bprotocol.com/openapi/upp-api.yaml",
        "endpoint": "https://api.vendor.example.com"
      },
      {
        "version": "0.2.0-draft",
        "spec": "https://b2bprotocol.com/specification/overview",
        "transport": "mcp",
        "schema": "https://b2bprotocol.com/openrpc/upp-mcp.json",
        "endpoint": "mcp://vendor-acme-industrial"
      }
    ]
  },
  "capabilities": [
    {
      "name": "com.b2bprotocol.procurement.intent",
      "version": "0.2.0-draft",
      "module": "UPP Discovery",
      "spec": "https://b2bprotocol.com/specification/intent",
      "schema": "https://b2bprotocol.com/schemas/intent.schema.json"
    },
    {
      "name": "com.b2bprotocol.procurement.discovery",
      "version": "0.2.0-draft",
      "module": "UPP Discovery",
      "spec": "https://b2bprotocol.com/specification/discovery",
      "schema": "https://b2bprotocol.com/schemas/discovery-response.schema.json"
    },
    {
      "name": "com.b2bprotocol.procurement.offering",
      "version": "0.2.0-draft",
      "module": "UPP Discovery",
      "spec": "https://b2bprotocol.com/specification/offering",
      "schema": "https://b2bprotocol.com/schemas/offering.schema.json",
      "extends": "com.b2bprotocol.procurement.discovery"
    },
    {
      "name": "com.b2bprotocol.procurement.rfq",
      "version": "0.2.0-draft",
      "module": "UPP RFQ",
      "spec": "https://b2bprotocol.com/specification/rfq",
      "schema": "https://b2bprotocol.com/schemas/rfq.schema.json"
    },
    {
      "name": "com.b2bprotocol.procurement.order",
      "version": "0.2.0-draft",
      "module": "UPP Orders",
      "spec": "https://b2bprotocol.com/specification/order",
      "schema": "https://b2bprotocol.com/schemas/purchase-order.schema.json"
    },
    {
      "name": "com.b2bprotocol.procurement.invoice",
      "version": "0.2.0-draft",
      "module": "UPP Invoice",
      "spec": "https://b2bprotocol.com/specification/invoice",
      "schema": "https://b2bprotocol.com/schemas/invoice.schema.json"
    },
    {
      "name": "com.b2bprotocol.procurement.approval",
      "version": "0.2.0-draft",
      "module": "UPP Approval",
      "spec": "https://b2bprotocol.com/specification/approval",
      "schema": "https://b2bprotocol.com/schemas/approval.schema.json"
    }
  ],
  "auth": {
    "methods": ["oauth2", "apiKey", "http-signatures"]
  },
  "signingKeys": [
    {
      "kid": "acme-2026-05",
      "kty": "EC",
      "crv": "P-256",
      "x": "WKn-ZIGevcwGIyyrzFoZNBdaq9_TsqzGl96oc0CWuis",
      "y": "y77t-RvAHRKTsSGdIYUfweuOvwrvDD-Q3Hv5J0fSKbE",
      "use": "sig",
      "alg": "ES256"
    }
  ],
  "bindings": [
    {
      "kind": "rest",
      "version": "0.2.0-draft",
      "endpoint": "https://api.vendor.example.com"
    },
    {
      "kind": "mcp",
      "version": "0.2.0-draft",
      "endpoint": "mcp://vendor-acme-industrial"
    }
  ],
  "endpoints": {
    "profile": "/.well-known/upp",
    "discovery": "/discovery/requests",
    "rfq": "/rfqs",
    "purchaseOrders": "/purchase-orders",
    "invoices": "/invoices",
    "approvals": "/approvals/{approvalId}"
  },
  "constraints": {
    "currencies": ["USD", "EUR"],
    "quoteValidityDays": 14,
    "approvalRequiredForPurchaseOrdersAbove": 10000
  },
  "extensions": {
    "com.vendorname.custom_pricing": {
      "supportsTierPricing": true
    }
  }
}
